{
  "version": "1.0.0",
  "lastUpdated": "2025-01-06T00:00:00Z",
  "checksum": "sha256:placeholder",
  "categories": [
    {
      "id": "chat-llm",
      "name": "Chat / LLM Assistants",
      "emoji": "üí¨",
      "description": "Conversational AI and language models",
      "sortOrder": 1
    },
    {
      "id": "writing-content",
      "name": "Writing & Content",
      "emoji": "‚úçÔ∏è",
      "description": "AI-powered writing and content creation tools",
      "sortOrder": 2
    },
    {
      "id": "code-dev",
      "name": "Code & Dev Tools",
      "emoji": "üë®‚Äçüíª",
      "description": "AI coding assistants and development tools",
      "sortOrder": 3
    },
    {
      "id": "image-gen",
      "name": "Image Generation",
      "emoji": "üé®",
      "description": "AI image creation and editing tools",
      "sortOrder": 4
    },
    {
      "id": "video-gen",
      "name": "Video Generation",
      "emoji": "üé¨",
      "description": "AI video creation and editing tools",
      "sortOrder": 5
    },
    {
      "id": "audio-speech",
      "name": "Audio & Speech",
      "emoji": "üéµ",
      "description": "Voice synthesis, transcription, and audio tools",
      "sortOrder": 6
    },
    {
      "id": "data-hosting",
      "name": "Data & Infrastructure",
      "emoji": "üóÑÔ∏è",
      "description": "Databases, hosting, and backend services",
      "sortOrder": 7
    },
    {
      "id": "automation",
      "name": "Automation & Agents",
      "emoji": "ü§ñ",
      "description": "AI agents and workflow automation",
      "sortOrder": 8
    },
    {
      "id": "api-marketplace",
      "name": "APIs & Marketplaces",
      "emoji": "üîå",
      "description": "API services and model marketplaces",
      "sortOrder": 9
    }
  ],
  "services": [
    {
      "serviceId": "openai-chatgpt",
      "slug": "chatgpt",
      "version": 1,
      "name": "ChatGPT",
      "provider": "OpenAI",
      "website": "https://chat.openai.com",
      "category": "chat-llm",
      "subcategories": ["writing", "coding", "analysis"],
      "tagline": "Advanced AI assistant powered by GPT-4",
      "briefDescription": "ChatGPT is OpenAI's conversational AI that can help with writing, analysis, coding, and creative tasks. Available with GPT-3.5 (free) and GPT-4 (paid) models.",
      "fullDescription": "ChatGPT represents the cutting edge of conversational AI, offering natural language understanding and generation capabilities. It excels at tasks ranging from creative writing and code generation to complex problem-solving and data analysis. The platform includes web browsing, code interpretation, and DALL-E image generation in premium tiers.",
      "keyFeatures": [
        {
          "title": "GPT-4 Access",
          "description": "Latest model with advanced reasoning"
        },
        {
          "title": "Code Interpreter",
          "description": "Execute Python code and analyze data"
        },
        {
          "title": "DALL-E Integration",
          "description": "Generate images from text descriptions"
        },
        {
          "title": "Custom GPTs",
          "description": "Create specialized AI assistants"
        }
      ],
      "useCases": ["Content creation", "Code debugging", "Research assistance", "Language translation", "Educational tutoring"],
      "limitations": ["Knowledge cutoff date", "No real-time information without browsing", "Token limits per conversation"],
      "pricing": {
        "model": "freemium",
        "currency": "USD",
        "tiers": [
          {
            "name": "Free",
            "cost": 0,
            "billingCycle": null,
            "features": ["GPT-3.5 access", "Standard response speed", "Regular model updates"],
            "limits": {
              "messagesPerDay": 50,
              "gpt4Access": false
            },
            "isFreeTier": true,
            "requiresCreditCard": false
          },
          {
            "name": "Plus",
            "cost": 20,
            "currency": "USD",
            "billingCycle": "monthly",
            "features": ["GPT-4 access", "Faster response times", "DALL-E image generation", "Advanced data analysis"],
            "limits": {
              "gpt4MessagesPerHour": 50,
              "dalleImagesPerDay": 50
            }
          },
          {
            "name": "Team",
            "cost": 30,
            "currency": "USD",
            "billingCycle": "monthly",
            "features": ["Everything in Plus", "Team workspace", "Admin controls", "Higher message limits"],
            "limits": {
              "gpt4MessagesPerHour": 100,
              "teamMembers": "unlimited"
            }
          }
        ]
      },
      "freeTrial": {
        "available": true,
        "duration": "Unlimited free tier",
        "creditCard": false
      },
      "api": {
        "available": true,
        "documentation": "https://platform.openai.com/docs",
        "type": "REST"
      },
      "sdks": ["Python", "Node.js", "C#", "Java"],
      "integrations": ["Zapier", "Make", "Slack", "Microsoft Teams"],
      "platforms": ["web", "ios", "android", "api"],
      "userBase": "100M+ users",
      "typicalUser": "Knowledge workers, developers, students",
      "alternatives": ["claude-ai", "google-gemini", "perplexity-ai"],
      "commonPairings": ["github-copilot", "notion-ai"],
      "support": {
        "documentation": "https://help.openai.com",
        "community": "https://community.openai.com"
      },
      "metadata": {
        "dateAdded": "2025-01-06T00:00:00Z",
        "lastVerified": "2025-01-06T00:00:00Z",
        "lastUpdated": "2025-01-06T00:00:00Z",
        "verificationStatus": "verified",
        "dataSource": "official"
      }
    },
    {
      "serviceId": "anthropic-claude",
      "slug": "claude",
      "version": 1,
      "name": "Claude",
      "provider": "Anthropic",
      "website": "https://claude.ai",
      "category": "chat-llm",
      "subcategories": ["writing", "coding", "analysis"],
      "tagline": "AI assistant focused on being helpful, harmless, and honest",
      "briefDescription": "Claude is Anthropic's AI assistant known for nuanced thinking, strong coding abilities, and careful reasoning. Available in multiple model sizes including the powerful Claude 3 Opus.",
      "fullDescription": "Claude represents Anthropic's approach to safe and capable AI. It excels at complex reasoning tasks, long-form content creation, and technical analysis. Claude can process very long documents (up to 200K tokens), making it ideal for analyzing codebases, research papers, and extensive documentation.",
      "keyFeatures": [
        {
          "title": "200K Context Window",
          "description": "Process entire books or codebases"
        },
        {
          "title": "Constitutional AI",
          "description": "Built with safety and helpfulness in mind"
        },
        {
          "title": "Strong Coding Skills",
          "description": "Excellent at debugging and code generation"
        },
        {
          "title": "Artifacts",
          "description": "Create and iterate on documents and code"
        }
      ],
      "useCases": ["Long document analysis", "Complex coding tasks", "Research synthesis", "Creative writing", "Technical documentation"],
      "limitations": ["No internet access", "No image generation", "Knowledge cutoff"],
      "pricing": {
        "model": "freemium",
        "currency": "USD",
        "tiers": [
          {
            "name": "Free",
            "cost": 0,
            "billingCycle": null,
            "features": ["Claude 3 Sonnet access", "Limited daily messages"],
            "limits": {
              "messagesPerDay": 30
            },
            "isFreeTier": true,
            "requiresCreditCard": false
          },
          {
            "name": "Pro",
            "cost": 20,
            "currency": "USD",
            "billingCycle": "monthly",
            "features": ["Claude 3 Opus access", "5x more usage", "Priority access", "Projects feature"],
            "limits": {
              "messagesPerDay": 300
            }
          }
        ]
      },
      "api": {
        "available": true,
        "documentation": "https://docs.anthropic.com",
        "type": "REST"
      },
      "sdks": ["Python", "TypeScript"],
      "platforms": ["web", "api"],
      "userBase": "Growing rapidly",
      "typicalUser": "Researchers, developers, writers",
      "alternatives": ["openai-chatgpt", "google-gemini"],
      "metadata": {
        "dateAdded": "2025-01-06T00:00:00Z",
        "lastVerified": "2025-01-06T00:00:00Z",
        "lastUpdated": "2025-01-06T00:00:00Z",
        "verificationStatus": "verified",
        "dataSource": "official"
      }
    },
    {
      "serviceId": "github-copilot",
      "slug": "github-copilot",
      "version": 1,
      "name": "GitHub Copilot",
      "provider": "GitHub/Microsoft",
      "website": "https://github.com/features/copilot",
      "category": "code-dev",
      "subcategories": ["ide-integration", "code-completion"],
      "tagline": "Your AI pair programmer",
      "briefDescription": "GitHub Copilot uses AI to suggest code completions and entire functions in real-time, right in your editor. Powered by OpenAI Codex and trained on billions of lines of code.",
      "fullDescription": "GitHub Copilot revolutionizes coding by providing intelligent code suggestions as you type. It understands context from comments and code, suggesting complete lines or entire functions. Copilot supports dozens of languages and integrates seamlessly with popular IDEs. The chat feature allows for code explanations, debugging help, and test generation.",
      "keyFeatures": [
        {
          "title": "Real-time Suggestions",
          "description": "Get code completions as you type"
        },
        {
          "title": "Multi-language Support",